{
  "causal_persistence_sample_counts": {
    "all_verified": true,
    "explanation": "persisted samples = declared test observations - segments x horizon. The first 'horizon' observations of each independent segment have no causal predecessor at the required lag and are removed. Setup 2 applies this separately to days 8, 9, and 10.",
    "setup_1_segments": 1,
    "setup_2_segments": 3,
    "total_causal_persistence_runs": 50,
    "verified_sample_count_invariant": 50
  },
  "classical_aggregates": {
    "causal_persistence|anchored_forward|h10": {
      "count": 9,
      "mean_accuracy": 0.523564672287926,
      "mean_balanced_accuracy": 0.3860884074109265,
      "mean_brier": 0.952870655424148,
      "mean_ece": 0.476435327712074,
      "mean_macro_f1": 0.3860858136627573,
      "mean_mcc": 0.09587530602829762,
      "mean_nll": 16.455493250483315,
      "seeds": [
        1337
      ],
      "std_accuracy": 0.053491861972328456,
      "std_balanced_accuracy": 0.01019753461253492,
      "std_brier": 0.10698372394465688,
      "std_ece": 0.053491861972328456,
      "std_macro_f1": 0.01019685290945455,
      "std_mcc": 0.021815008543762598,
      "std_nll": 1.8475434596096774
    },
    "causal_persistence|anchored_forward|h100": {
      "count": 9,
      "mean_accuracy": 0.37828609314857015,
      "mean_balanced_accuracy": 0.36064774969572333,
      "mean_brier": 1.2434278137028596,
      "mean_ece": 0.6217139068514298,
      "mean_macro_f1": 0.36065871785759085,
      "mean_mcc": 0.033829090353262536,
      "mean_nll": 21.473237610347862,
      "seeds": [
        1337
      ],
      "std_accuracy": 0.014046067282435385,
      "std_balanced_accuracy": 0.016262850865674215,
      "std_brier": 0.02809213456487081,
      "std_ece": 0.014046067282435388,
      "std_macro_f1": 0.016270207755197708,
      "std_mcc": 0.028737428479214136,
      "std_nll": 0.4851339770959059
    },
    "causal_persistence|anchored_forward|h20": {
      "count": 9,
      "mean_accuracy": 0.44792072747937106,
      "mean_balanced_accuracy": 0.38076946804961714,
      "mean_brier": 1.1041585450412579,
      "mean_ece": 0.5520792725206289,
      "mean_macro_f1": 0.38076801661419385,
      "mean_mcc": 0.08323871772718405,
      "mean_nll": 19.06814254585496,
      "seeds": [
        1337
      ],
      "std_accuracy": 0.04901594866967767,
      "std_balanced_accuracy": 0.009178674094471706,
      "std_brier": 0.0980318973393553,
      "std_ece": 0.049015948669677664,
      "std_macro_f1": 0.009178163105732882,
      "std_mcc": 0.021086121717687433,
      "std_nll": 1.6929508908864173
    },
    "causal_persistence|anchored_forward|h30": {
      "count": 9,
      "mean_accuracy": 0.41200843667376374,
      "mean_balanced_accuracy": 0.3769067585003273,
      "mean_brier": 1.1759831266524725,
      "mean_ece": 0.5879915633262364,
      "mean_macro_f1": 0.3769061646730859,
      "mean_mcc": 0.07441360101715892,
      "mean_nll": 20.30850912781884,
      "seeds": [
        1337
      ],
      "std_accuracy": 0.04547074040378142,
      "std_balanced_accuracy": 0.012434433983421847,
      "std_brier": 0.09094148080756283,
      "std_ece": 0.045470740403781414,
      "std_macro_f1": 0.012433700097491309,
      "std_mcc": 0.025751825107071576,
      "std_nll": 1.5705037353172373
    },
    "causal_persistence|anchored_forward|h50": {
      "count": 9,
      "mean_accuracy": 0.3779859879269447,
      "mean_balanced_accuracy": 0.3660484672551959,
      "mean_brier": 1.2440280241461108,
      "mean_ece": 0.6220140120730554,
      "mean_macro_f1": 0.3660505435922323,
      "mean_mcc": 0.05222492971936957,
      "mean_nll": 21.48360287749254,
      "seeds": [
        1337
      ],
      "std_accuracy": 0.03530775176501528,
      "std_balanced_accuracy": 0.0189905565777243,
      "std_brier": 0.07061550353003056,
      "std_ece": 0.03530775176501528,
      "std_macro_f1": 0.01898857699546688,
      "std_mcc": 0.033992393507625555,
      "std_nll": 1.2194865432188762
    },
    "causal_persistence|first_seven_final_three|h10": {
      "count": 1,
      "mean_accuracy": 0.5980925356664302,
      "mean_balanced_accuracy": 0.3964962815782889,
      "mean_brier": 0.8038149286671395,
      "mean_ece": 0.40190746433356983,
      "mean_macro_f1": 0.39649135401775676,
      "mean_mcc": 0.12161605103596622,
      "mean_nll": 13.881392042062709,
      "seeds": [
        1337
      ]
    },
    "causal_persistence|first_seven_final_three|h100": {
      "count": 1,
      "mean_accuracy": 0.38556362043837544,
      "mean_balanced_accuracy": 0.3841729862805974,
      "mean_brier": 1.2288727591232491,
      "mean_ece": 0.6144363795616246,
      "mean_macro_f1": 0.3841980110612066,
      "mean_mcc": 0.0774046616007692,
      "mean_nll": 21.221880722577417,
      "seeds": [
        1337
      ]
    },
    "causal_persistence|first_seven_final_three|h20": {
      "count": 1,
      "mean_accuracy": 0.5167888652375526,
      "mean_balanced_accuracy": 0.3905828963016343,
      "mean_brier": 0.9664222695248949,
      "mean_ece": 0.48321113476244737,
      "mean_macro_f1": 0.3905776153257549,
      "mean_mcc": 0.10977533536718687,
      "mean_nll": 16.68952133509122,
      "seeds": [
        1337
      ]
    },
    "causal_persistence|first_seven_final_three|h30": {
      "count": 1,
      "mean_accuracy": 0.4764977024595511,
      "mean_balanced_accuracy": 0.3941439052240205,
      "mean_brier": 1.0470045950808977,
      "mean_ece": 0.5235022975404489,
      "mean_macro_f1": 0.39413948788779174,
      "mean_mcc": 0.11064559681868051,
      "mean_nll": 18.081128796971566,
      "seeds": [
        1337
      ]
    },
    "causal_persistence|first_seven_final_three|h50": {
      "count": 1,
      "mean_accuracy": 0.42255642333096666,
      "mean_balanced_accuracy": 0.3868989743362215,
      "mean_brier": 1.1548871533380667,
      "mean_ece": 0.5774435766690333,
      "mean_macro_f1": 0.38690009019732435,
      "mean_mcc": 0.09365775461081861,
      "mean_nll": 19.944194575249206,
      "seeds": [
        1337
      ]
    },
    "deeplob|anchored_forward|h10": {
      "count": 45,
      "mean_accuracy": 0.707958399367117,
      "mean_balanced_accuracy": 0.5758673935130025,
      "mean_brier": 0.4119091145215243,
      "mean_ece": 0.0665411198097977,
      "mean_macro_f1": 0.5955101964011972,
      "mean_mcc": 0.42200717998487725,
      "mean_nll": 0.7729590723084843,
      "seeds": [
        1337,
        2027,
        31415,
        424242,
        8675309
      ],
      "std_accuracy": 0.11340642746746993,
      "std_balanced_accuracy": 0.1123331788045274,
      "std_brier": 0.15358772466636872,
      "std_ece": 0.07571870360327178,
      "std_macro_f1": 0.12493976623909313,
      "std_mcc": 0.19307667078392937,
      "std_nll": 0.3207062498345122
    },
    "deeplob|anchored_forward|h100": {
      "count": 45,
      "mean_accuracy": 0.6787465439021395,
      "mean_balanced_accuracy": 0.6676369100656324,
      "mean_brier": 0.4640100128250633,
      "mean_ece": 0.12452087382155325,
      "mean_macro_f1": 0.6712749943893596,
      "mean_mcc": 0.4967147054662763,
      "mean_nll": 0.870263529752813,
      "seeds": [
        1337,
        2027,
        31415,
        424242,
        8675309
      ],
      "std_accuracy": 0.07830392122068312,
      "std_balanced_accuracy": 0.08754329923365323,
      "std_brier": 0.12968498105444212,
      "std_ece": 0.0815660187530635,
      "std_macro_f1": 0.08439945048983888,
      "std_mcc": 0.13159780777821514,
      "std_nll": 0.3204580203965839
    },
    "deeplob|anchored_forward|h20": {
      "count": 45,
      "mean_accuracy": 0.5684198360919054,
      "mean_balanced_accuracy": 0.49113602998134515,
      "mean_brier": 0.5653153463579036,
      "mean_ece": 0.10592872052633272,
      "mean_macro_f1": 0.4993360340633329,
      "mean_mcc": 0.2704022894049508,
      "mean_nll": 1.00029965141513,
      "seeds": [
        1337,
        2027,
        31415,
        424242,
        8675309
      ],
      "std_accuracy": 0.13066640037333335,
      "std_balanced_accuracy": 0.1011182391276977,
      "std_brier": 0.1552495286788969,
      "std_ece": 0.09538336870471942,
      "std_macro_f1": 0.10976117424866084,
      "std_mcc": 0.17612001336249847,
      "std_nll": 0.29742974446149556
    },
    "deeplob|anchored_forward|h30": {
      "count": 45,
      "mean_accuracy": 0.6129796794425614,
      "mean_balanced_accuracy": 0.5796854524098999,
      "mean_brier": 0.5059288167850908,
      "mean_ece": 0.08144889705195398,
      "mean_macro_f1": 0.5840084370173847,
      "mean_mcc": 0.39303816404074404,
      "mean_nll": 0.8806728445869416,
      "seeds": [
        1337,
        2027,
        31415,
        424242,
        8675309
      ],
      "std_accuracy": 0.1335800743891658,
      "std_balanced_accuracy": 0.11409105952297637,
      "std_brier": 0.1472793108681127,
      "std_ece": 0.08292807247342433,
      "std_macro_f1": 0.1193087472166304,
      "std_mcc": 0.1834610769065585,
      "std_nll": 0.2508747092684776
    },
    "deeplob|anchored_forward|h50": {
      "count": 45,
      "mean_accuracy": 0.659212003229617,
      "mean_balanced_accuracy": 0.6522105176093774,
      "mean_brier": 0.4621779602602066,
      "mean_ece": 0.07863313778817421,
      "mean_macro_f1": 0.6521445305543675,
      "mean_mcc": 0.48291565327361796,
      "mean_nll": 0.8141455908067086,
      "seeds": [
        1337,
        2027,
        31415,
        424242,
        8675309
      ],
      "std_accuracy": 0.10725001234995428,
      "std_balanced_accuracy": 0.10115120571810558,
      "std_brier": 0.14006379031399482,
      "std_ece": 0.08041614821861796,
      "std_macro_f1": 0.1015309505351596,
      "std_mcc": 0.1560917552169284,
      "std_nll": 0.25754465917201014
    },
    "deeplob|first_seven_final_three|h10": {
      "count": 5,
      "mean_accuracy": 0.8153234259458684,
      "mean_balanced_accuracy": 0.655993204310923,
      "mean_brier": 0.2705823135219754,